{
  "id": "vogue-germany-liquid-hair",
  "title": "Liquid Hair: So bekommen Sie ultraglänzendes Haar wie Kim Kardashian, Jennifer Lopez & Co.",
  "url": "https://www.vogue.de/beauty/artikel/liquid-hair-glaenzendes-haar-kim-kardashian-jennifer-lopez",
  "publisher": "Vogue Germany",
  "reviewedAt": "2026-09-24"
}
