{
  "id": "source-washington-post-diana-red-cross-1997",
  "title": "From London, a blitz with glitz",
  "publisher": "The Washington Post",
  "url": "https://www.washingtonpost.com/archive/lifestyle/1997/06/18/from-london-a-blitz-with-glitz/e597a0dc-b04b-41d3-b901-e28dfa85c2bb/",
  "reviewedAt": "2026-09-30"
}
