{
  "id": "vogue-india-volumising-haircuts-straight-hair",
  "title": "10 volumising haircuts to try for straight hair, according to experts",
  "url": "https://www.vogue.in/content/10-volumising-haircuts-to-try-for-straight-hair-according-to-experts",
  "publisher": "Vogue India",
  "reviewedAt": "2026-09-24"
}
