{
  "id": "vogue-cher-hair-2014",
  "title": "Elizabeth Olsen's New Miu Miu Campaign: Why We Are Obsessed with Her 1970s Cher Hair",
  "url": "https://www.vogue.com/article/elizabeth-olsens-new-miu-miu-campaign-why-we-are-obsessed-with-her-1970s-cher-hair",
  "publisher": "Vogue",
  "reviewedAt": "2026-09-24"
}
