{
  "id": "nmaahc-black-is-beautiful",
  "title": "Black is Beautiful: The Emergence of Black Culture and Identity in the 60s and 70s",
  "url": "https://nmaahc.si.edu/explore/stories/black-beautiful-emergence-black-culture-and-identity-60s-and-70s",
  "publisher": "National Museum of African American History and Culture",
  "reviewedAt": "2026-09-24"
}
