{
  "id": "source-harpers-bazaar-diana-short-layered-crop-2025",
  "title": "How to Style Princess Diana's Timeless Pixie Bob Haircut, According to Her Hairdresser",
  "publisher": "Harper's Bazaar",
  "url": "https://www.harpersbazaar.com/beauty/hair/a69461135/princess-diana-haircut-pixie-bob/",
  "reviewedAt": "2026-10-09"
}
