{
  "id": "telemundo-edgar-origin",
  "title": "Cómo surgió y qué hay detrás del ‘Edgar’, el corte de cabello que se ha vuelto viral entre jóvenes latinos",
  "url": "https://www.telemundo.com/noticias/noticias-telemundo/cultura/como-surgio-y-que-hay-detras-de-el-edgar-el-corte-de-cabello-que-se-ha-rcna74085",
  "publisher": "Telemundo",
  "reviewedAt": "2026-09-25"
}
